{
  "schemaVersion": 1,
  "textSha256": "bbf525bb7604706f8ed555dd7e772284fcd9a53a6d6422378adbd3afced793ad",
  "source": {
    "commit": "41d341693f9b19a82cdc5cf96576841ba68e879f",
    "name": "arxiv",
    "originalPath": "datasets/corpus/human/science/arxiv/arxiv-2006-04633.md",
    "license": "LICENSE.md"
  },
  "labels": []
}
