{
  "schemaVersion": 1,
  "textSha256": "eb177d0e82e1986230da06a6b925438a0b7563ad7da4a687eb9aa1f7b6b1d7fc",
  "source": {
    "commit": "41d341693f9b19a82cdc5cf96576841ba68e879f",
    "name": "gutenberg",
    "originalPath": "datasets/corpus/human/literary/gutenberg/gb-02147-the-works-of-edgar-allan-poe-volume-1-p04.md",
    "license": "LICENSE.md"
  },
  "labels": []
}
