{
  "schemaVersion": 1,
  "textSha256": "a10ba3fc272a64504575e342d65edd0ecdeb15bf3a75ba9424f27b86a3dae1c4",
  "source": {
    "commit": "41d341693f9b19a82cdc5cf96576841ba68e879f",
    "name": "peps",
    "originalPath": "datasets/corpus/human/tech/peps/pep-0373.md",
    "license": "LICENSE.md"
  },
  "labels": []
}
