{
  "schemaVersion": 1,
  "textSha256": "e797e289873493773ee044f4569776a28c766b0de95e0604df2d31ebcbbc5cc5",
  "source": {
    "commit": "41d341693f9b19a82cdc5cf96576841ba68e879f",
    "name": "devto",
    "originalPath": "datasets/corpus/ai-suspected/tech/devto/devto-3781551.md",
    "license": "LICENSE.md"
  },
  "labels": []
}
