{
  "schemaVersion": 1,
  "textSha256": "20a9af6a66e61e6e123c2e05a1933aa464fc4aaf3d00d9ed5fccd371a75dac49",
  "source": {
    "commit": "41d341693f9b19a82cdc5cf96576841ba68e879f",
    "name": "wikipedia",
    "originalPath": "datasets/corpus/human/reference/wikipedia/wiki-01688-pilot-devious-maids.md",
    "license": "LICENSE.md"
  },
  "labels": []
}
