{
  "schemaVersion": 1,
  "textSha256": "29aa03eb43e89c7031813b49d80c88937f34f0ea2cb37ff5f0eb1dd396067037",
  "source": {
    "commit": "41d341693f9b19a82cdc5cf96576841ba68e879f",
    "name": "gov-health",
    "originalPath": "datasets/corpus/human/gov/gov-health/fr-2019-27930-adoption-of-recommendations.md",
    "license": "LICENSE.md"
  },
  "labels": []
}
