{
  "schemaVersion": 1,
  "textSha256": "0ca2af9276cc98eeb292ed3c615ed8c34c396769bf8dc18c54e7c1735062a5ac",
  "source": {
    "commit": "41d341693f9b19a82cdc5cf96576841ba68e879f",
    "name": "pubmed",
    "originalPath": "datasets/corpus/human/medical/pubmed/pubmed-33816391.md",
    "license": "LICENSE.md"
  },
  "labels": []
}
