{
  "schemaVersion": 1,
  "textSha256": "834225febb2e5daab43fc011e21c7fcc151597f9354da863a35d2c7e3528bf3f",
  "source": {
    "commit": "41d341693f9b19a82cdc5cf96576841ba68e879f",
    "name": "mdn",
    "originalPath": "datasets/corpus/human/tech/mdn/mdn-01308-web-javascript-reference-operators-strict_equality.md",
    "license": "LICENSE.md"
  },
  "labels": []
}
