{
  "schemaVersion": 1,
  "textSha256": "2873a442b8ea05bfa77c0072ff2e253521907b3e1c50ead93b632cbb112a21b3",
  "source": {
    "commit": "41d341693f9b19a82cdc5cf96576841ba68e879f",
    "name": "wikipedia",
    "originalPath": "datasets/corpus/human/reference/wikipedia/wiki-01281-jordan-kovacs.md",
    "license": "LICENSE.md"
  },
  "labels": []
}
