{
  "schemaVersion": 1,
  "textSha256": "dc76d83c927ab88c92f48666e21edfd07d6d0c061accbd1bb05113983bca031f",
  "source": {
    "commit": "41d341693f9b19a82cdc5cf96576841ba68e879f",
    "name": "mdn",
    "originalPath": "datasets/corpus/human/tech/mdn/mdn-00076-mozilla-firefox-releases-3-dom_improvements.md",
    "license": "LICENSE.md"
  },
  "labels": []
}
