{
  "schemaVersion": 1,
  "textSha256": "207010a0b8fd22a5f0f55e368240fb68c46bd666df72e55d417596bfe0468308",
  "source": {
    "commit": "41d341693f9b19a82cdc5cf96576841ba68e879f",
    "name": "a16z",
    "originalPath": "datasets/corpus/human/business/a16z/a16z-085.md",
    "url": "https://a16z.com/2011/07/19/when-employees-misinterpret-managers",
    "license": "LICENSE.md"
  },
  "labels": []
}
