{
  "schemaVersion": 1,
  "textSha256": "f1957693ba4f759f71af177327e0018999b9378dd03c2f43af08d5ccec02d4ed",
  "source": {
    "commit": "41d341693f9b19a82cdc5cf96576841ba68e879f",
    "name": "courtlistener",
    "originalPath": "datasets/corpus/human/legal/courtlistener/op-4859119.md",
    "license": "../LICENSE.md"
  },
  "labels": []
}
