{
  "schemaVersion": 1,
  "textSha256": "cec1039db9da48a507a429dddb3366e52bab6194e1ee93de28549c5d54356be2",
  "source": {
    "commit": "41d341693f9b19a82cdc5cf96576841ba68e879f",
    "name": "gutenberg",
    "originalPath": "datasets/corpus/human/literary/gutenberg/gb-00245-life-on-the-mississippi-p03.md",
    "license": "LICENSE.md"
  },
  "labels": []
}
