{
  "schemaVersion": 1,
  "textSha256": "873f66f96c63811fd7bc2d93969538b4c76275cf673dad2b0859b1b8a1dc7e12",
  "source": {
    "commit": "41d341693f9b19a82cdc5cf96576841ba68e879f",
    "name": "stackexchange",
    "originalPath": "datasets/corpus/human/motivational/stackexchange/se-writers-33980.md",
    "license": "LICENSE.md"
  },
  "labels": []
}
