{
  "schemaVersion": 1,
  "textSha256": "910aa8dd21c016ea99d3ec3bb9026e2ab0a2e302764f75e36919190646586273",
  "source": {
    "commit": "41d341693f9b19a82cdc5cf96576841ba68e879f",
    "name": "pubmed",
    "originalPath": "datasets/corpus/human/medical/pubmed/pubmed-34713039.md",
    "license": "LICENSE.md"
  },
  "labels": []
}
