{
  "schemaVersion": 1,
  "textSha256": "6696c98429dab9291e8566a549ec533898527940302854e9477f477f038125b3",
  "source": {
    "commit": "41d341693f9b19a82cdc5cf96576841ba68e879f",
    "name": "Claude test generation",
    "originalPath": "datasets/corpus/ai-generated/realestate/claude/claude-sonnet-b3-2.md",
    "model": "claude-sonnet",
    "prompt": null,
    "license": "../../LICENSE.md",
    "notes": "Generated by the project for testing. The original generation prompt is unavailable. Origin alone supplies no passage-level slop judgments."
  },
  "labels": []
}
