{
  "schemaVersion": 1,
  "textSha256": "3a95813af6c188ad1933d12215c1d7c2e14c76d3281b2f12205920a7292b7d89",
  "source": {
    "commit": "41d341693f9b19a82cdc5cf96576841ba68e879f",
    "name": "gutenberg",
    "originalPath": "datasets/corpus/human/literary/gutenberg/gb-37734-some-jewish-witnesses-for-christ-p03.md",
    "license": "LICENSE.md"
  },
  "labels": []
}
