{
  "schemaVersion": 1,
  "textSha256": "4157db180948eca626941e2ee339bbee672a366df1936b4c647255b2caa6b194",
  "source": {
    "commit": "41d341693f9b19a82cdc5cf96576841ba68e879f",
    "name": "gov-health",
    "originalPath": "datasets/corpus/human/gov/gov-health/fr-2019-28111-comment-request-multiple-internal-revenu.md",
    "license": "LICENSE.md"
  },
  "labels": []
}
