{
  "schemaVersion": 1,
  "textSha256": "88192bf3a4195e473d60a03a9a785d191f077efddfce756f7eb0dee81e9799fd",
  "source": {
    "commit": "41d341693f9b19a82cdc5cf96576841ba68e879f",
    "name": "mdn",
    "originalPath": "datasets/corpus/human/tech/mdn/mdn-01339-web-api-visualviewport.md",
    "license": "LICENSE.md"
  },
  "labels": []
}
