{
  "schemaVersion": 1,
  "textSha256": "358e0992df4b34e6311717c169f5c7edebf230084b6c00e62e37c36e22f65dd6",
  "source": {
    "commit": "41d341693f9b19a82cdc5cf96576841ba68e879f",
    "name": "wikipedia",
    "originalPath": "datasets/corpus/human/reference/wikipedia/wiki-00322-if-i-never-see-your-face-again.md",
    "license": "LICENSE.md"
  },
  "labels": []
}
