{
  "schemaVersion": 1,
  "textSha256": "a35a889a541d7892036f2f54327f5fa70c3dfadf361a721dc95d536acae85827",
  "source": {
    "commit": "41d341693f9b19a82cdc5cf96576841ba68e879f",
    "name": "mdn",
    "originalPath": "datasets/corpus/human/tech/mdn/mdn-00918-web-api-iirfilternode-getfrequencyresponse.md",
    "license": "LICENSE.md"
  },
  "labels": []
}
