{
  "schemaVersion": 1,
  "textSha256": "0f8d9be9a38345af726bf84fc835bbede902709cb1d0aa176d9b435547a4a50b",
  "source": {
    "commit": "41d341693f9b19a82cdc5cf96576841ba68e879f",
    "name": "wikipedia",
    "originalPath": "datasets/corpus/human/reference/wikipedia/wiki-03802-battle-of-the-alamo.md",
    "license": "LICENSE.md"
  },
  "labels": []
}
