{
  "schemaVersion": 1,
  "textSha256": "bacf53ec46a68315b1d5a344893b88df642136e5e6ff8ee962e78d5c75862f47",
  "source": {
    "commit": "41d341693f9b19a82cdc5cf96576841ba68e879f",
    "name": "mdn",
    "originalPath": "datasets/corpus/human/tech/mdn/mdn-00042-web-html-using_the_application_cache.md",
    "license": "LICENSE.md"
  },
  "labels": []
}
