{
  "schemaVersion": 1,
  "textSha256": "007fc92b5265f22915410d3145f29cd638d82dced6d9e277271ae227eccb1e7e",
  "source": {
    "commit": "41d341693f9b19a82cdc5cf96576841ba68e879f",
    "name": "wikipedia",
    "originalPath": "datasets/corpus/human/reference/wikipedia/wiki-03898-marvel-vs-capcom-clash-of-super-heroes.md",
    "license": "LICENSE.md"
  },
  "labels": []
}
